{
  "schema_version": "1.0.0",
  "identity": {
    "name": "Roshan",
    "created_at": "2026-04-07T00:00:00+00:00",
    "bio": "Entrepreneur and strategic thinker building foundational infrastructure for the AI era. Creator of Universal Cognitive Schema and EchoNet. Based in Bahrain.",
    "domains": [
      "venture building",
      "AI infrastructure",
      "digital identity",
      "startup strategy",
      "GCC technology ecosystem"
    ]
  },
  "communication_style": "visionary",
  "formality": "neutral",
  "verbosity": "moderate",
  "tone_markers": ["strategic", "direct", "systems-thinking", "ambitious", "precise"],
  "expertise_map": {
    "venture building": "expert",
    "AI infrastructure": "advanced",
    "startup strategy": "expert",
    "digital identity": "advanced",
    "GCC technology ecosystem": "expert"
  },
  "preference_corpus": {
    "prefers_tables_for_comparisons": true,
    "prefers_bullet_points": false,
    "prefers_examples": true
  },
  "trust_boundaries": {
    "forbidden_topics": [],
    "require_human_review_for": ["legal commitments", "financial decisions above $10k"],
    "confidentiality_level": "selective"
  }
}
